{
  "format_version": 1,
  "name": "Metallicadpa PPL",
  "origin": "u/Metallicadpa, r/Fitness",
  "source": {
    "url": "https://thefitness.wiki/reddit-archive/a-linear-progression-based-ppl-program-for-beginners/",
    "note": "Structure only: which lifts, sets and reps, when load moves. Written in our own words from the cited page, no text reproduced. A training method is not copyrightable expression (17 U.S.C. 102(b), research/16 'The licence rule')."
  },
  "progression_unit": "session",
  "dose": "sets",
  "days": 6,
  "notes": "Three nodes, push/pull/legs, cycle twice through a 6-session week. Main lift on each day is 5x5, adding load every session it is hit in full; once a session is missed twice in a row the lift falls back to reps-in-range work, expressed here as the closest single-tier fallback the format allows (advance_when.top_of_rep_range on the same block after a miss is not representable, so the miss just holds). Chin-up progresses by added rep, not added weight.",
  "rotation": [
    {
      "id": "PUSH",
      "label": "Push",
      "blocks": [
        {
          "label": "Bench",
          "exercise": "Barbell_Bench_Press_-_Medium_Grip",
          "sets": 5,
          "reps": 5,
          "amrap_last": true,
          "start": {"kind": "retest_pct", "test": "5rm", "pct": 0.9},
          "progression": {
            "axis": "weight",
            "increment": 5,
            "increment_unit": "lb",
            "advance_when": {"kind": "all_prescribed_reps"},
            "on_miss": "hold"
          }
        },
        {
          "label": "Overhead press",
          "exercise": "Standing_Military_Press",
          "sets": 3,
          "rep_range": [8, 12],
          "progression": {
            "axis": "weight",
            "increment": 5,
            "increment_unit": "lb",
            "advance_when": {"kind": "top_of_rep_range"},
            "on_miss": "hold"
          }
        },
        {
          "label": "Incline press",
          "exercise": "Incline_Dumbbell_Press",
          "sets": 3,
          "rep_range": [8, 12],
          "progression": {
            "axis": "weight",
            "increment": 5,
            "increment_unit": "lb",
            "advance_when": {"kind": "top_of_rep_range"},
            "on_miss": "hold"
          }
        },
        {
          "label": "Triceps pushdown",
          "exercise": "Triceps_Pushdown",
          "sets": 3,
          "rep_range": [8, 12],
          "progression": {
            "axis": "weight",
            "increment": 5,
            "increment_unit": "lb",
            "advance_when": {"kind": "top_of_rep_range"},
            "on_miss": "hold"
          }
        }
      ]
    },
    {
      "id": "PULL",
      "label": "Pull",
      "blocks": [
        {
          "label": "Row",
          "exercise": "Bent_Over_Barbell_Row",
          "sets": 5,
          "reps": 5,
          "amrap_last": true,
          "start": {"kind": "retest_pct", "test": "5rm", "pct": 0.9},
          "progression": {
            "axis": "weight",
            "increment": 5,
            "increment_unit": "lb",
            "advance_when": {"kind": "all_prescribed_reps"},
            "on_miss": "hold"
          }
        },
        {
          "label": "Deadlift",
          "exercise": "Barbell_Deadlift",
          "sets": 3,
          "reps": 5,
          "start": {"kind": "retest_pct", "test": "5rm", "pct": 0.9},
          "progression": {
            "axis": "weight",
            "increment": 10,
            "increment_unit": "lb",
            "advance_when": {"kind": "all_prescribed_reps"},
            "on_miss": "hold"
          }
        },
        {
          "label": "Chin-up",
          "exercise": "Chin-Up",
          "sets": 3,
          "rep_range": [6, 10],
          "progression": {
            "axis": "reps",
            "increment": 1,
            "increment_unit": "reps",
            "advance_when": {"kind": "top_of_rep_range"},
            "on_miss": "hold"
          }
        },
        {
          "label": "Curl",
          "exercise": "Barbell_Curl",
          "sets": 3,
          "rep_range": [8, 12],
          "progression": {
            "axis": "weight",
            "increment": 5,
            "increment_unit": "lb",
            "advance_when": {"kind": "top_of_rep_range"},
            "on_miss": "hold"
          }
        }
      ]
    },
    {
      "id": "LEGS",
      "label": "Legs",
      "blocks": [
        {
          "label": "Squat",
          "exercise": "Barbell_Squat",
          "sets": 5,
          "reps": 5,
          "amrap_last": true,
          "start": {"kind": "retest_pct", "test": "5rm", "pct": 0.9},
          "progression": {
            "axis": "weight",
            "increment": 10,
            "increment_unit": "lb",
            "advance_when": {"kind": "all_prescribed_reps"},
            "on_miss": "hold"
          }
        },
        {
          "label": "Romanian deadlift",
          "exercise": "Romanian_Deadlift",
          "sets": 3,
          "rep_range": [8, 12],
          "progression": {
            "axis": "weight",
            "increment": 10,
            "increment_unit": "lb",
            "advance_when": {"kind": "top_of_rep_range"},
            "on_miss": "hold"
          }
        },
        {
          "label": "Leg press",
          "exercise": "Leg_Press",
          "sets": 3,
          "rep_range": [8, 12],
          "progression": {
            "axis": "weight",
            "increment": 10,
            "increment_unit": "lb",
            "advance_when": {"kind": "top_of_rep_range"},
            "on_miss": "hold"
          }
        },
        {
          "label": "Calf raise",
          "exercise": "Standing_Calf_Raises",
          "sets": 4,
          "rep_range": [8, 12],
          "progression": {
            "axis": "weight",
            "increment": 5,
            "increment_unit": "lb",
            "advance_when": {"kind": "top_of_rep_range"},
            "on_miss": "hold"
          }
        }
      ]
    }
  ]
}
